{
  "domainRootSecure" : "undefined" ,
  "domainRoot" : "mktgchallenge.eloqua.com" ,
  "pulseUrl" : "undefined" ,
  "idleTime" : "undefined" ,
  "productTrim" : "undefined" ,
  "defaultContactImportSourceId" : "undefined" ,
  "components" : [
    null ,
    null
  ] ,
  "enableClientLogging" : "undefined" ,
  "name" : "undefined" ,
  "description" : "Eloqua" ,
  "permissions" : "undefined" ,
  "folderId" : "undefined" ,
  "sourceTemplateId" : "undefined" ,
  "createdBy" : "undefined" ,
  "createdAt" : "undefined" ,
  "updatedBy" : "undefined" ,
  "updatedAt" : "undefined" ,
  "accessedAt" : "undefined" ,
  "scheduledFor" : "undefined" ,
  "depth" : "minimal"
}